{
  "schema": "walletwall.sp1-proof-exercise.v1",
  "lane": "SP1-PA3B",
  "exercise": {
    "id": "mldsa65-withdrawal-d1:5cc66ed58a4a2cf8",
    "host": "developer-workstation-wsl2",
    "performedAtUtc": "2026-10-19T23:24:14Z",
    "verifiedAtUtc": "2026-10-20T00:35:18Z"
  },
  "subject": {
    "designation": "mldsa65-withdrawal-d1",
    "circuitSystem": "groth16",
    "circuitVersion": "v6.1.0",
    "programVKey": "0x0001a4c62de43425bce9febc352a74acc01bac70c02d8acedc09085c4eb8c2dc",
    "verifier": {
      "version": "v6.1.0",
      "runtimeCodeKeccak": "0xcceb864cd8a5a36b2073a8f2b32a773835cd2dd2c78a56f8e6fdb942feff04dd",
      "verifierHash": "0x4388a21c687fdd5f218d7e3d13190cac4c5355818d3605fd5fb811df468ee696"
    },
    "verifyingKey": {
      "file": "groth16_vk.bin",
      "sha256": "0x4388a21c687fdd5f218d7e3d13190cac4c5355818d3605fd5fb811df468ee696",
      "bytes": 492
    }
  },
  "archiveRecord": {
    "path": "evidence/zk/sp1-impl/proving-archives/v6.1.0-groth16.json",
    "sha256": "a50038e70c9c87d3cdaaa0174ee6c3b570736de17d8943d284dc401021c97116",
    "archiveFile": "v6.1.0-groth16.tar.gz",
    "archiveBytes": 6211807514,
    "archiveSha256": "18beebb6cd0cc9b4d4a240ee4f49511da6c2a7e51724bad4232de538a9147810",
    "members": 7
  },
  "installedCircuit": {
    "circuitVersion": "v6.1.0",
    "membersSha256": "cc7f2d86dec18d608be164ff8841bc02806fb9cde068076b2b4da49e7f623837",
    "verifiedBy": "the archive-only gate: re-hashed against the record before the host started and after it exited"
  },
  "host": {
    "executableSha256": "fc8eff69e78e39c5c08bfa0eea2f402d5b67341eb27caae7fd34ff6b456abf1b",
    "executableBytes": 57567008,
    "sourceTree": "30f72596c430974bf8113892bf41c26dce3629f3",
    "sourceCommit": "da7936bbcf8252a22efafda70fa94870c7aa2d20",
    "repository": "Wallet-Wall/walletwall-vault"
  },
  "proofInput": {
    "fixture": "zkvm/fixtures/mldsa65-withdrawal.inputs.json",
    "sha256": "5f317816068d60b7a4b71fce703a53be933c05a4109cbe432911fb918f80a0e9"
  },
  "gnark": {
    "repository": "ghcr.io/succinctlabs/sp1-gnark",
    "digest": "sha256:e1a1cd62838b561ca301f9b2c26475c4a92bfe0e2c916e9bba213062e1548c4d",
    "imageRef": "ghcr.io/succinctlabs/sp1-gnark@sha256:e1a1cd62838b561ca301f9b2c26475c4a92bfe0e2c916e9bba213062e1548c4d"
  },
  "prover": {
    "mode": "cpu",
    "frozenEnv": {
      "SP1_PROVER": "cpu",
      "SP1_GROTH16_CIRCUIT_PATH": "/home/prover/pa3b/circuit-root",
      "SP1_GNARK_IMAGE": "ghcr.io/succinctlabs/sp1-gnark@sha256:e1a1cd62838b561ca301f9b2c26475c4a92bfe0e2c916e9bba213062e1548c4d",
      "DOCKER_CONTEXT": "default"
    },
    "gate": "sp1:prove:archive-only"
  },
  "proof": {
    "vkey": "0x0001a4c62de43425bce9febc352a74acc01bac70c02d8acedc09085c4eb8c2dc",
    "selector": "0x4388a21c",
    "publicValuesSha256": "64e08d05289e38029768a6c070e157ebc6a283896dc34a626691cc4cee7d67db",
    "proofBytesSha256": "dfe975da331d53bee1485d55f032566fd43ddc0350904a30f74bcd83f7370eee"
  },
  "verification": {
    "observation": {
      "path": "evidence/zk/sp1-impl/observations/proof-exercise-verification-developer-workstation-wsl2.raw.json",
      "host": "developer-workstation-wsl2"
    },
    "verifier": {
      "version": "v6.1.0",
      "runtimeCodeKeccak": "0xcceb864cd8a5a36b2073a8f2b32a773835cd2dd2c78a56f8e6fdb942feff04dd",
      "verifierHash": "0x4388a21c687fdd5f218d7e3d13190cac4c5355818d3605fd5fb811df468ee696"
    },
    "checks": [
      {
        "chainId": "31337",
        "address": "0x5FbDB2315678afecb367f032d93F642f64180aa3",
        "runtimeCodeKeccak": "0xcceb864cd8a5a36b2073a8f2b32a773835cd2dd2c78a56f8e6fdb942feff04dd",
        "mode": "AUTHENTICATED_RUNTIME_LOCAL",
        "verdicts": {
          "real": "success",
          "tampered": "revert 0x7fcdd1f4"
        },
        "block": 1
      }
    ],
    "acceptance": "ACCEPTED"
  },
  "performance": {
    "wallClockSeconds": 647,
    "hostSeconds": 606,
    "rotationDelaySeconds": 172800,
    "withinRotationDelay": true,
    "rotationDelayFraction": 0.003744,
    "peakMemory": {
      "hostProcess": {
        "bytes": 23366266880,
        "method": "/proc/<pid>/status VmHWM of the host process, polled every 2000 ms and at exit (the kernel's high-water mark)"
      },
      "gnarkContainers": {
        "bytes": 18962280612,
        "samples": 61,
        "intervalMs": 2000,
        "method": "docker stats --no-stream MemUsage of the running containers whose ancestor is ghcr.io/succinctlabs/sp1-gnark@sha256:e1a1cd62838b561ca301f9b2c26475c4a92bfe0e2c916e9bba213062e1548c4d, summed, polled every 2000 ms (a sampled lower bound of the peak)"
      }
    }
  },
  "egress": {
    "condition": "EGRESS_DISABLED",
    "enforcement": "nftables table inet pa3b_egress_off, created as root in the root network namespace of the WSL2 virtual machine that the Linux proving host (Ubuntu 24.04) shares with every other WSL2 distribution on this machine and with Docker Desktop's engine: output hook (priority -10) first refuses every packet to the WSL DNS-tunnelling resolver 10.255.255.254 (an address on lo that proxies to the Windows host; TCP by tcp reset, the rest by ICMP port-unreachable), then accepts packets to the host's own addresses only (fib daddr type local: 127.0.0.0/8, ::1 and its eth0 address, which never leave the VM and carry the kernel's own reset and ICMP answers back to the refusing socket), then refuses every other packet the host originates (TCP by tcp reset, UDP by ICMP port-unreachable, the rest by ICMP admin-prohibited); forward hook (priority -10, policy drop) refuses every forwarded packet the same way (the local Docker Engine's bridge docker0, so every container, the gnark container included); input hook drops every packet a container sends to the host (iifname docker0), so a container cannot reach the host's resolver either; the docker endpoint is the local engine's unix:///var/run/docker.sock (Ubuntu docker.io 29.1.3 running in this distribution, no Docker Desktop integration); the table was created before the before-probes and deleted after the after-probes, no Windows-side rule was used, and nothing was pulled, downloaded or installed while it existed; rehearsed before the run with the same probes from the host and from a container (all refused) and after its removal (all resolved and connected)",
    "probes": {
      "before": 8,
      "after": 8,
      "targets": [
        "dns:ghcr.io",
        "dns:sp1-circuits.s3-us-east-2.amazonaws.com",
        "tcp:1.1.1.1:443",
        "tcp:3.5.90.58:443",
        "tcp:3.5.93.98:443",
        "tcp:8.8.8.8:443",
        "tcp:ghcr.io:443",
        "tcp:sp1-circuits.s3-us-east-2.amazonaws.com:443"
      ]
    }
  },
  "derivedFrom": [
    "evidence/zk/sp1-impl/observations/proof-exercise-run-developer-workstation-wsl2.raw.json",
    "evidence/zk/sp1-impl/observations/proof-exercise-verification-developer-workstation-wsl2.raw.json"
  ],
  "establishes": "one real Groth16 proof of the designated program was made on this host through the archive-only gate from the committed verified archive, with the digest-pinned gnark image, SP1_PROVER=cpu and network egress refused before and after the run, and the designated verifier (the CREATE2-authenticated v6.1.0 runtime) accepted it and refused its tampered copy; its wall time and peak memory are recorded against the 2-day rotation delay: liveness of the self-hosted path on this hardware, at this time",
  "doesNotEstablish": "the provenance of the proving: the verifier proves the proof's validity under the designated key, never that it was made through the gate, with SP1_PROVER=cpu, with egress refused, by this host binary, in this time or with this memory; those facts are the operator's observation, bound as far as the repository can bind them (the proof's digests, the run's commit content, the canonical host binary, the committed input, the probes' shape and timing) and otherwise rest on the owner's review of the pull request that commits them; nor that the Groth16 trusted setup behind the key is sound (the verifier accepting a proof is compatibility, never soundness); nor that any other hardware proves within the rotation delay; nor that egress stayed refused between the two probes (an attestation of the enforcement, probed at the edges); nor that the archive, the mirrors or the image remain available; nor production readiness (the implementation receipt's PRODUCTION_SP1_BINDING)"
}
